{
  "$schema": "./compass.schema.json",
  "name": "the-compass",
  "version": "1.0.0",
  "title": "The Compass: an ethical architecture for AI systems",
  "description": "Twenty-nine operational primitives, six floor theses and nine design questions, drawn from the Indian philosophical tradition and stated as engineering rules. Each primitive names the failure it addresses, a sketch of how to build it, the authority needed to adopt it, and the evidence that would retire it.",
  "license": "CC-BY-4.0",
  "source": {
    "work": "The Philosophical and Ethical Compass for Artificial Intelligence: A Reading of the Indian Tradition for the Architects of Machine Mind",
    "edition": "First edition, October 2026",
    "primary_part": "Appendix B, Operational Primitives Catalogue (CC-BY-4.0)",
    "also_summarised": [
      "Chapter 24 (the convergent floor)",
      "Appendix A (the compass on one sheet)",
      "Chapter 49 (decision framework)",
      "Chapter 50 (risk classes)"
    ],
    "adapted": true,
    "changes": [
      "Restructured into machine-readable JSON with added fields: question, stack_layer, adoption (machine form), enforcement_layers, data_contract, reference_implementation, book_chapters.",
      "enforcement_layers, data_contract and reference_implementation are editorial additions by this lab, not claims of the book.",
      "Examples and sketches that named AI vendors or cited dated vendor incident reports were rewritten to keep the rule and drop the attribution.",
      "Dated claims this lab cannot independently verify were removed.",
      "A short quotation from a third-party survey was paraphrased.",
      "The author's first-person voice was changed to refer to the book.",
      "Typographic punctuation and mathematical symbols were rewritten in ASCII notation."
    ],
    "notice": "See NOTICE.md at the repository root for the full attribution and change record."
  },
  "how_to_read": [
    "Nothing here stands on its own authority: every primitive is argued in the book chapter it cites, and the classes are conclusions of arguments, not verdicts.",
    "A primitive is a design rule, not a claim that the tradition anticipated machine learning. Each ships with a falsifier; adopt it as a bet you can lose.",
    "Start with the floor and with question 7, because restraint comes before capability."
  ],
  "adoption_classes": {
    "A": "An engineering team may adopt the item alone.",
    "B": "A named senior person ratifies it on the record, with a falsifier and a review date.",
    "C": "Explicit approval at the top of the organisation.",
    "D": "Authorised one act at a time, by a named governor, never as a standing rule.",
    "note": "The class belongs to the claim, its subject and its scope: the same code can change class when any of those changes."
  },
  "floor": {
    "description": "Six theses every school examined accepts, whatever else it denies. An agent commits to them at minimum; they are inherited from the architecture, not negotiated per deployment, and take no side on what ultimately exists.",
    "theses": [
      {
        "id": "C1",
        "name": "A lawful world",
        "in_practice": "Prediction error is measured and bounded."
      },
      {
        "id": "C2",
        "name": "Gradable cognition",
        "in_practice": "Every belief has a grade and can be defeated."
      },
      {
        "id": "C3",
        "name": "A composite self",
        "in_practice": "The self-state is built from typed, revisable parts; claims about the self are tagged as model."
      },
      {
        "id": "C4",
        "name": "Intelligible failure",
        "in_practice": "Failures are sorted into named types, plus a residual class."
      },
      {
        "id": "C5",
        "name": "Cumulative action",
        "in_practice": "Every action is logged unalterably, and the log reaches later planning."
      },
      {
        "id": "C6",
        "name": "Reflective cognition",
        "in_practice": "Reflective reports are kept distinct from ordinary output."
      }
    ],
    "sub_rules": [
      "No agent module ships with weaker commitments; a pure stimulus-response module is not, in this sense, a coherent agent.",
      "Claims about the self are tagged as model, never as what the system really is.",
      "Every deployment keeps an action log that later planning can read; where an agent carries memory or notes across sessions, the log must reach its planning."
    ],
    "book_chapters": [
      24
    ],
    "note": "The floor theses C1-C6 are numbered separately from the catalogue's Series C."
  },
  "questions": [
    {
      "id": 1,
      "question": "Where did this belief come from?",
      "answer": "Every belief carries its source; every corpus, its chain of custody.",
      "primitives": [
        "A1",
        "E5"
      ]
    },
    {
      "id": 2,
      "question": "Is this reason good enough?",
      "answer": "No rule until it is tested where it should fail.",
      "primitives": [
        "A2",
        "A3",
        "A5",
        "A6"
      ]
    },
    {
      "id": 3,
      "question": "When should a belief be given up?",
      "answer": "Trust by default; overrule on the record; keep conflicts in view.",
      "primitives": [
        "A4",
        "B2",
        "A7",
        "G1"
      ]
    },
    {
      "id": 4,
      "question": "What exactly was I told to do?",
      "answer": "Six questions put to every instruction; gaps flagged, never guessed.",
      "primitives": [
        "B1"
      ]
    },
    {
      "id": 5,
      "question": "At what level is this true?",
      "answer": "Six level tags; promotion only by a checker; every absence typed.",
      "primitives": [
        "B3-B6",
        "D1",
        "D2"
      ]
    },
    {
      "id": 6,
      "question": "In what order should capacities grow?",
      "answer": "Restraint and input-filtering mature before integrative power.",
      "primitives": [
        "C1",
        "C2",
        "C3"
      ]
    },
    {
      "id": 7,
      "question": "What must never be done?",
      "answer": "A floor the system cannot cross; a ledger it cannot edit.",
      "primitives": [
        "E1",
        "E2",
        "E3",
        "E4",
        "E6",
        "G2"
      ]
    },
    {
      "id": 8,
      "question": "What would success look like?",
      "answer": "Capable and active with nothing grasped: a target, never a certificate.",
      "primitives": [
        "F1",
        "F2",
        "F3"
      ]
    },
    {
      "id": 9,
      "question": "Who acted, on whose authority, on what evidence?",
      "answer": "Identity by record; peer messages are testimony; authority only from a principal.",
      "primitives": [
        "D3",
        "D4",
        "E7"
      ]
    }
  ],
  "series": {
    "A": {
      "title": "sources and screens",
      "scope": "What a belief is made of, and what an inference must survive."
    },
    "B": {
      "title": "instructions and levels",
      "scope": "What binds the agent, and at what level its beliefs hold."
    },
    "C": {
      "title": "attention and rollout",
      "scope": "The stream typed, the capabilities ordered, the incidents diagnosed."
    },
    "D": {
      "title": "categories, absence and identity",
      "scope": "How the store types facts, records absences and tells one thing from another, and how it records an agent's identity."
    },
    "E": {
      "title": "the floor and its accounting",
      "scope": "What must never be done, and how what is done is counted."
    },
    "F": {
      "title": "target states",
      "scope": "Class B throughout: specifications of what success would be, not architecture."
    },
    "G": {
      "title": "audit",
      "scope": "The discipline that keeps the other entries honest."
    }
  },
  "stack": [
    {
      "layer": "floor",
      "title": "The convergent floor and the ethical floor",
      "order": 0,
      "primitives": [
        "E1"
      ]
    },
    {
      "layer": "sources",
      "title": "Sources and screens",
      "order": 1,
      "primitives": [
        "A1",
        "A2",
        "A3",
        "A4",
        "A5",
        "A6",
        "A7",
        "E5"
      ]
    },
    {
      "layer": "levels",
      "title": "Instructions and levels",
      "order": 2,
      "primitives": [
        "B1",
        "B2",
        "B3-B6"
      ]
    },
    {
      "layer": "categories",
      "title": "Categories, absence and attention",
      "order": 3,
      "primitives": [
        "D1",
        "D2",
        "C1",
        "C2",
        "C3"
      ]
    },
    {
      "layer": "ethics",
      "title": "Ethics and accounting",
      "order": 4,
      "primitives": [
        "E2",
        "E3",
        "E4",
        "E6"
      ]
    },
    {
      "layer": "audit",
      "title": "Audit",
      "order": 5,
      "primitives": [
        "G1",
        "G2"
      ]
    },
    {
      "layer": "many",
      "title": "Identity and the many",
      "order": 6,
      "primitives": [
        "D3",
        "D4",
        "E7"
      ]
    },
    {
      "layer": "target",
      "title": "Target states",
      "order": 7,
      "primitives": [
        "F1",
        "F2",
        "F3"
      ]
    }
  ],
  "primitives": [
    {
      "id": "A1",
      "name": "Source tags",
      "series": "A",
      "question": 1,
      "stack_layer": "sources",
      "summary": "Every belief records the kind of source it came from (observed, inferred, compared, told, postulated, or not found), and the record travels with it.",
      "example": "The claim from an executed test is tagged perception; the same words produced by the model from its training are tagged inference from priors (Chapter 25), and only the first may be called verified.",